{
  "schema_version": "0.2",
  "version": 1,
  "question": "How does formative assessment affect achievement?",
  "resources": [{"resource": "eric", "queries": ["formative assessment"]}],
  "inclusion": ["peer-reviewed"],
  "exclusion": ["non-education"],
  "saturation_rule": {"batch_size": 10, "no_new_items_in_batches": 2},
  "budget": {"max_requests": 50}
}
